<?xml version="1.0" encoding="UTF-8"?>
<xs:schema xmlns:xs="http://www.w3.org/2001/XMLSchema">
    <xs:element name="root">
        <xs:complexType>
            <xs:sequence>
                <!-- Book enitity (Thành Trí) -->
                <xs:element name="books">
                    <xs:complexType>
                        <xs:sequence>
                            <xs:element name="book" maxOccurs="unbounded">
                                <xs:complexType>
                                    <xs:sequence>
                                        <xs:element name="title" type="xs:string" />
                                        <xs:element name="page_count" type="xs:integer" />
                                        <xs:element name="price" type="xs:decimal" />
                                        <xs:element name="amount" type="xs:integer" />
                                        <xs:element name="publish_year" type="xs:gYear" />
                                        <xs:element name="description" type="xs:string" />
                                        <xs:element name="thumbnail" type="xs:anyURI" />
                                        <xs:element name="available" type="xs:boolean" />
                                    </xs:sequence>
                                    <xs:attribute name="id" type="xs:ID" use="required" />
                                </xs:complexType>
                            </xs:element>
                        </xs:sequence>
                    </xs:complexType>
                </xs:element>
                <!-- Author entity (Thế Vinh) -->
                <xs:element name="authors">
                    <xs:complexType>
                        <xs:sequence>
                            <xs:element name="author" maxOccurs="unbounded">
                                <xs:complexType>
                                    <xs:sequence>
                                        <xs:element name="full_name" type="xs:string" />
                                        <xs:element name="date_of_birth" type="xs:date" />
                                        <xs:element name="avatar" type="xs:anyURI" />
                                    </xs:sequence>
                                    <xs:attribute name="id" type="xs:string" use="required" />
                                </xs:complexType>
                            </xs:element>
                        </xs:sequence>
                    </xs:complexType>
                </xs:element>

                <!-- Genre entity (Thế Vinh) -->
                <xs:element name="genres">
                    <xs:complexType>
                        <xs:sequence>
                            <xs:element name="genre" maxOccurs="unbounded">
                                <xs:complexType>
                                    <xs:sequence>
                                        <xs:element name="genre_name" type="xs:string" />
                                    </xs:sequence>
                                    <xs:attribute name="id" type="xs:string" use="required" />
                                </xs:complexType>
                            </xs:element>
                        </xs:sequence>
                    </xs:complexType>
                </xs:element>

                <!-- Role entity (Quốc Việt) -->
                <xs:element name="roles">
                    <xs:complexType>
                        <xs:sequence>
                            <xs:element name="role" maxOccurs="unbounded">
                                <xs:complexType>
                                    <xs:sequence>
                                        <xs:element name="role_name" type="xs:string" />
                                    </xs:sequence>
                                    <xs:attribute name="id" type="xs:ID" use="required" />
                                </xs:complexType>
                            </xs:element>
                        </xs:sequence>
                    </xs:complexType>
                </xs:element>
                <!-- User entity (Quốc Việt) -->
                <xs:element name="users">
                    <xs:complexType>
                        <xs:sequence>
                            <xs:element name="user" maxOccurs="unbounded">
                                <xs:complexType>
                                    <xs:sequence>
                                        <xs:element name="username" type="xs:string" />
                                        <xs:element name="password" type="xs:string" />
                                        <xs:element name="numberphone" type="xs:string" />

                                        <xs:element name="email" type="xs:string" />
                                        <xs:element name="gender" type="xs:string" />
                                    </xs:sequence>
                                    <xs:attribute name="id" type="xs:ID" use="required" />
                                    <xs:attribute name="role_id" type="xs:IDREF" use="required" />
                                </xs:complexType>
                            </xs:element>
                        </xs:sequence>
                    </xs:complexType>
                </xs:element>
                <!-- Order entity (Thành Trí) -->
                <xs:element name="orders">
                    <xs:complexType>
                        <xs:sequence>
                            <xs:element name="order" maxOccurs="unbounded">
                                <xs:complexType>
                                    <xs:sequence>
                                        <xs:element name="customer_name" type="xs:string" />
                                        <xs:element name="tel" type="xs:string" />
                                        <xs:element name="order_date" type="xs:date" />
                                        <xs:element name="status" type="xs:string" />
                                        <xs:element name="order_address" type="xs:string" />
                                        <xs:element name="payment_method" type="xs:string" />
                                        <xs:element name='discount' type="xs:decimal" minOccurs="0" />
                                        <xs:element name="total_amount" type="xs:decimal" />
                                        <xs:element name="note" type="xs:string" minOccurs="0" />
                                    </xs:sequence>
                                    <xs:attribute name="id" type="xs:ID" use="required" />
                                    <xs:attribute name="customer_id" type="xs:IDREF" use="required" />
                                </xs:complexType>
                            </xs:element>
                        </xs:sequence>
                    </xs:complexType>
                </xs:element>
                <!-- Address entity (Quốc Việt) -->
                <xs:element name="addresses">
                    <xs:complexType>
                        <xs:sequence>
                            <xs:element name="address" maxOccurs="unbounded">
                                <xs:complexType>
                                    <xs:sequence>
                                        <xs:element name="detailed_address" type="xs:string" />
                                        <xs:element name="city" type="xs:string" />
                                        <xs:element name="ward" type="xs:string" />
                                        <xs:element name="default" type="xs:boolean" />
                                        <xs:element name="created_date" type="xs:date" />
                                    </xs:sequence>
                                    <xs:attribute name="id" type="xs:ID" use="required" />
                                    <xs:attribute name="user_id" type="xs:IDREF" use="required" />
                                </xs:complexType>
                            </xs:element>
                        </xs:sequence>
                    </xs:complexType>
                </xs:element>
                <!-- Review entity (Quốc Việt) -->
                <xs:element name="reviews">
                    <xs:complexType>
                        <xs:sequence>
                            <xs:element name="review" maxOccurs="unbounded">
                                <xs:complexType>
                                    <xs:sequence>
                                        <xs:element name="rating" type="xs:integer" />
                                        <xs:element name="comment" type="xs:string" />
                                        <xs:element name="date" type="xs:date" />
                                    </xs:sequence>
                                    <xs:attribute name="id" type="xs:ID" use="required" />
                                    <xs:attribute name="user_id" type="xs:IDREF" use="required" />
                                    <xs:attribute name="book_id" type="xs:IDREF" use="required" />
                                </xs:complexType>
                            </xs:element>
                        </xs:sequence>
                    </xs:complexType>
                </xs:element>
                <!-- Genre detail entity (Thế Vinh) -->
                <xs:element name="genre_details">
                    <xs:complexType>
                        <xs:sequence>
                            <xs:element name="genre_detail" maxOccurs="unbounded">
                                <xs:complexType>
                                    <xs:attribute name="genre_id" type="xs:string" use="required" />
                                    <xs:attribute name="book_id" type="xs:string" use="required" />
                                </xs:complexType>
                            </xs:element>
                        </xs:sequence>
                    </xs:complexType>
                </xs:element>

                <!-- Author detail entity (Thế Vinh) -->
                <xs:element name="author_details">
                    <xs:complexType>
                        <xs:sequence>
                            <xs:element name="author_detail" maxOccurs="unbounded">
                                <xs:complexType>
                                    <xs:sequence>
                                        <xs:element name="author_role" type="xs:string" />
                                    </xs:sequence>
                                    <xs:attribute name="author_id" type="xs:string" use="required" />
                                    <xs:attribute name="book_id" type="xs:string" use="required" />
                                </xs:complexType>
                            </xs:element>
                        </xs:sequence>
                    </xs:complexType>
                </xs:element>

                <!-- Order detail entity (Thành Trí) -->
                <xs:element name="order_details">
                    <xs:complexType>
                        <xs:sequence>
                            <xs:element name="order_detail" maxOccurs="unbounded">
                                <xs:complexType>
                                    <xs:sequence>
                                        <xs:element name="quantity" type="xs:integer" />
                                        <xs:element name="unit_price" type="xs:decimal" />
                                    </xs:sequence>
                                    <xs:attribute name="id" type="xs:ID" use="required" />
                                    <xs:attribute name="order_id" type="xs:IDREF" use="required" />
                                    <xs:attribute name="book_id" type="xs:IDREF" use="required" />
                                </xs:complexType>
                            </xs:element>
                        </xs:sequence>
                    </xs:complexType>
                </xs:element>
            </xs:sequence>
        </xs:complexType>
    </xs:element>
</xs:schema>