<?xml version="1.0" encoding="UTF-8"?>

<root xmlns:xsi="http://www.w3.org/2001/XMLSchema-instance"
      xsi:noNamespaceSchemaLocation="root.xsd">
    <!-- Book enitity (Thành Trí) -->
    <books>
        <book id="B001">
            <title>Hướng dẫn dành cho Nhà phát triển XML</title>
            <page_count>352</page_count>
            <price>44.95</price>
            <amount>20</amount>
            <publish_year>2000</publish_year>
            <description>Cái nhìn chuyên sâu về việc tạo ứng dụng với XML.</description>
            <thumbnail>xml_developer_guide.jpg</thumbnail>
            <available>true</available>
        </book>

        <book id="B002">
            <title>Cơn mưa lúc nửa đêm</title>
            <page_count>256</page_count>
            <price>5.95</price>
            <amount>30</amount>
            <publish_year>2001</publish_year>
            <description>Một cựu kiến trúc sư chiến đấu chống lại xác sống công ty, một phù thủy độc
                ác, và tuổi thơ của chính mình để trở thành nữ hoàng của thế giới.</description>
            <thumbnail>midnight_rain.jpg</thumbnail>
            <available>true</available>
        </book>

        <book id="B003">
            <title>Maeve Thăng Thiên</title>
            <page_count>272</page_count>
            <price>5.95</price>
            <amount>5</amount>
            <publish_year>2000</publish_year>
            <description>Sau sự sụp đổ của một xã hội công nghệ nano ở Anh, những người sống sót trẻ
                tuổi đặt nền móng cho một xã hội mới.</description>
            <thumbnail>maeve_ascendant.jpg</thumbnail>
            <available>true</available>
        </book>

        <book id="B004">
            <title>Di sản của Oberon</title>
            <page_count>300</page_count>
            <price>5.95</price>
            <amount>0</amount>
            <publish_year>2001</publish_year>
            <description>Tại nước Anh thời hậu tận thế, đặc vụ bí ẩn chỉ được biết đến với tên
                Oberon giúp tạo ra một cuộc sống mới cho cư dân London. Phần tiếp theo của Maeve
                Thăng Thiên.</description>
            <thumbnail>oberons_legacy.jpg</thumbnail>
            <available>false</available>
        </book>

        <book id="B005">
            <title>Chén Thánh Phân Chia</title>
            <page_count>400</page_count>
            <price>5.95</price>
            <amount>0</amount>
            <publish_year>2001</publish_year>
            <description>Hai cô con gái của Maeve, hai chị em cùng cha khác mẹ, chiến đấu với nhau
                để giành quyền kiểm soát nước Anh. Phần tiếp theo của Di sản của Oberon.</description>
            <thumbnail>sundered_grail.jpg</thumbnail>
            <available>false</available>
        </book>

        <book id="B006">
            <title>Những chú chim tình nhân</title>
            <page_count>150</page_count>
            <price>4.95</price>
            <amount>15</amount>
            <publish_year>2000</publish_year>
            <description>Khi Carla gặp Paul tại một hội nghị nghiên cứu chim, căng thẳng tăng cao
                khi có xích mích.</description>
            <thumbnail>lover_birds.jpg</thumbnail>
            <available>true</available>
        </book>

        <book id="B007">
            <title>Tung tóe</title>
            <page_count>200</page_count>
            <price>4.95</price>
            <amount>8</amount>
            <publish_year>2000</publish_year>
            <description>Một thợ lặn biển sâu tìm thấy tình yêu đích thực hai mươi ngàn dặm dưới đáy
                biển.</description>
            <thumbnail>splish_splash.jpg</thumbnail>
            <available>true</available>
        </book>
    </books>

    <!-- Author entity (Thế Vinh) -->
    <authors>
        <author id="AU001">
            <full_name>Hồ Anh Thái</full_name>
            <date_of_birth>1980-01-01</date_of_birth>
            <avatar>
                https://cand.com.vn/Files/Image/thanhbinh/2020/05/25/thumb_660_f6a85596-232f-4237-a9e6-48c71c477213.JPG
                </avatar>
        </author>
        <author id="AU002">
            <full_name>Nguyễn Vĩnh Nguyên</full_name>
            <date_of_birth>1979-05-01</date_of_birth>
            <avatar> https://www.netabooks.vn/data/author/8331/logo-nguyen-vinh-nguyen.jpg </avatar>
        </author>
        <author id="AU003">
            <full_name>Nguyễn Trương Quý</full_name>
            <date_of_birth>1989-06-04</date_of_birth>
            <avatar>
                https://encrypted-tbn1.gstatic.com/images?q=tbn:ANd9GcSwn_mokrmX3dECxWh-T-cM0fEggb4_uZPOQ2KVSx-rJBi7ZnxC3Z_gGYicTMdim8jlRf0A7VtaITCMH845X1eBNCdBQImh7gBWE-Gx-Fc_
                </avatar>
        </author>
        <author id="AU004">
            <full_name>Đỗ Bích Thúy</full_name>
            <date_of_birth>1995-08-05</date_of_birth>
            <avatar> https://vanvn.vn/wp-content/uploads/2021/03/Do-Bich-Thuy-vanvn.jpg </avatar>
        </author>
        <author id="AU005">
            <full_name>Nguyễn Mai Chi</full_name>
            <date_of_birth>1998-04-09</date_of_birth>
            <avatar>
                https://tramvanhoc.com/wp-content/uploads/2024/07/Gioi-thieu-tac-gia-Nguyen-Mai-Chi-Tieu-su-su-nghiep-phong-cach-sang-tac-nhan-dinh.jpg
                </avatar>
        </author>

        <author id="AU006">
            <full_name>Lê Nhật Thiên</full_name>
            <date_of_birth>1917-02-25</date_of_birth>
            <avatar>
                https://encrypted-tbn0.gstatic.com/images?q=tbn:ANd9GcQRjIEQi65pbyd1sAhVTuuLq1986APk5D_7iw&amp;s
                </avatar>
        </author>
        <author id="AU007">
            <full_name>Trần Hải Đăng</full_name>
            <date_of_birth>1928-04-04</date_of_birth>
            <avatar>
                https://encrypted-tbn2.gstatic.com/images?q=tbn:ANd9GcRjjVutIhtrkRs86P8HcPKZm1-gmlb0xexI7ZPTed7g61BZr2lcJBkwAMKdP0x9WSGgVRml-6TU1J3IDcmpTw_KPbxgZnHBEY4trfPRBhDt1w
                </avatar>
        </author>
    </authors>

    <!-- Genre entity (Thế Vinh) -->
    <genres>
        <genre id="G001">
            <genre_name>Tình cảm</genre_name>
        </genre>
        <genre id="G002">
            <genre_name>Tâm lý</genre_name>
        </genre>
        <genre id="G003">
            <genre_name>Học thuật</genre_name>
        </genre>
        <genre id="G004">
            <genre_name>Thiếu nhi</genre_name>
        </genre>
        <genre id="G005">
            <genre_name>Kỹ năng</genre_name>
        </genre>
        <genre id="G006">
            <genre_name>Tiểu thuyết</genre_name>
        </genre>
        <genre id="G007">
            <genre_name>Tài chính</genre_name>
        </genre>
        <genre id="G008">
            <genre_name>Kinh doanh</genre_name>
        </genre>
    </genres>

    <!-- Role entity (Quốc Việt) -->
    <roles>
        <role id="R001">
            <role_name>Quản trị viên</role_name>
        </role>
        <role id="R002">
            <role_name>Quản lý</role_name>
        </role>
        <role id="R003">
            <role_name>Nhân viên</role_name>
        </role>
        <role id="R004">
            <role_name>Khách hàng</role_name>
        </role>
    </roles>

    <!-- User entity (Quốc Việt) -->
    <users>
        <user id="U001" role_id="R001">
            <username>Lại Trần Thế Vinh</username>
            <password>12345</password>
            <numberphone>0907435567</numberphone>
            <email>vinhltth@gmail.com</email>
            <gender>Nam</gender>
        </user>
        <user id="U002" role_id="R002">
            <username>Võ Quốc Việt</username>
            <password>12345</password>
            <numberphone>0907313461</numberphone>
            <email>vietvq@gmail.com</email>
            <gender>Nam</gender>
        </user>
        <user id="U003" role_id="R003">
            <username>Dương Thành Trí</username>
            <password>12345</password>
            <numberphone>0907313462</numberphone>
            <email>dtt@gmail.com</email>
            <gender>Nam</gender>
        </user>
        <user id="U004" role_id="R004">
            <username>Danh Nhật Tiến</username>
            <password>12345</password>
            <numberphone>0907313463</numberphone>
            <email>dnt@gmail.com</email>
            <gender>Nam</gender>
        </user>
        <user id="U005" role_id="R004">
            <username>Trần Quang Minh</username>
            <password>12345</password>
            <numberphone>0907313464</numberphone>
            <email>cqm@gmail.com</email>
            <gender>Nam</gender>
        </user>
    </users>

    <!-- Order entity (Thành Trí) -->
    <orders>
        <order id="O001" customer_id="U001">
            <customer_name>Nguyễn Văn A</customer_name>
            <tel>0123456789</tel>
            <order_date>2024-06-15</order_date>
            <status>Đang xử lý</status>
            <order_address>123 Đường Hai Bà Trưng, Phường 1, Quận 1, TP. Hồ Chí Minh</order_address>
            <payment_method>Thẻ Tín dụng</payment_method>
            <discount>10.4</discount>
            <total_amount>150.75</total_amount>
            <note>Vui lòng giao hàng trong khoảng từ 9 giờ sáng đến 5 giờ chiều.</note>
        </order>

        <order id="O002" customer_id="U002">
            <customer_name>Trần Thị B</customer_name>
            <tel>9876543210</tel>
            <order_date>2024-06-16</order_date>
            <status>Đã gửi hàng</status>
            <order_address>456 Phố Hàng Gai, Phường Hàng Gai, Quận Hoàn Kiếm, Hà Nội</order_address>
            <payment_method>PayPal</payment_method>
            <discount>5.0</discount>
            <total_amount>89.50</total_amount>
        </order>

        <order id="O003" customer_id="U003">
            <customer_name>Lê Thị C</customer_name>
            <tel>0123456789</tel>
            <order_date>2024-06-17</order_date>
            <status>Đã giao hàng</status>